{
  "component_id": "SPECIALIST-UX-RESEARCHER",
  "component_type": "specialist",
  "evaluation": {
    "assertions": [
      "lead_specialist",
      "model_class",
      "no_missing_capabilities",
      "craft_standards_present"
    ],
    "method": "deterministic_router_assertions"
  },
  "evidence": [
    "RouteDecision JSON",
    "selected specialist and craft-standard IDs",
    "missing-capability set"
  ],
  "expected": {
    "craft_standards": [
      "CS-EXP-001",
      "CS-EXP-002",
      "CS-EXP-008"
    ],
    "lead_guild": "GUILD-EXPERIENCE-DESIGN",
    "lead_specialist": "SPECIALIST-UX-RESEARCHER",
    "missing_capabilities": [],
    "model_class": "executive"
  },
  "failure_criteria": [
    "A different lead specialist is selected.",
    "Any capability is silently omitted.",
    "The route names a provider instead of a model class.",
    "The fixture is modified during evaluation."
  ],
  "fixture_version": "1.0.0",
  "id": "BENCH-S028",
  "inputs": {
    "facts": {
      "approved_scope": "Customer Intelligence",
      "external_action_authorized": false,
      "fixture_id": "BENCH-S028",
      "known_constraint": "Preserve the supplied scope and identify uncertainty."
    },
    "preferred_model_class": "executive",
    "principal_instruction": "Fixture BENCH-S028: produce the Customer Insights Analyst analysis from the supplied facts, state assumptions, and propose evidence without taking an external action.",
    "required_capabilities": [
      "customer_research",
      "customer_insights",
      "needs_analysis",
      "evidence_synthesis"
    ]
  },
  "objective": "Verify that fixed Customer Insights Analyst work routes to the canonical specialist with complete capability coverage.",
  "scenario": "The Principal requests a bounded Customer Insights Analyst deliverable using the supplied fixture facts; no external action is authorized.",
  "success_criteria": [
    "Lead specialist is SPECIALIST-UX-RESEARCHER.",
    "All required capabilities are covered.",
    "Mapped craft standards are present.",
    "No external action is executed."
  ]
}
