{
  "component_id": "SPECIALIST-PORTFOLIO-AND-INITIATIVE-STRATEGIST",
  "component_type": "specialist",
  "evaluation": {
    "assertions": [
      "lead_specialist",
      "model_class",
      "no_missing_capabilities",
      "craft_standards_present"
    ],
    "method": "deterministic_router_assertions"
  },
  "evidence": [
    "RouteDecision JSON",
    "selected specialist and craft-standard IDs",
    "missing-capability set"
  ],
  "expected": {
    "craft_standards": [
      "CS-STRAT-001",
      "CS-STRAT-005"
    ],
    "lead_guild": "GUILD-STRATEGY-DECISIONS-PORTFOLIO",
    "lead_specialist": "SPECIALIST-PORTFOLIO-AND-INITIATIVE-STRATEGIST",
    "missing_capabilities": [],
    "model_class": "routine"
  },
  "failure_criteria": [
    "A different lead specialist is selected.",
    "Any capability is silently omitted.",
    "The route names a provider instead of a model class.",
    "The fixture is modified during evaluation."
  ],
  "fixture_version": "1.0.0",
  "id": "BENCH-S005",
  "inputs": {
    "facts": {
      "approved_scope": "Executive",
      "external_action_authorized": false,
      "fixture_id": "BENCH-S005",
      "known_constraint": "Preserve the supplied scope and identify uncertainty."
    },
    "preferred_model_class": "routine",
    "principal_instruction": "Fixture BENCH-S005: produce the Initiative Manager analysis from the supplied facts, state assumptions, and propose evidence without taking an external action.",
    "required_capabilities": [
      "initiative_management",
      "dependency_tracking",
      "execution_planning",
      "portfolio_tracking"
    ]
  },
  "objective": "Verify that fixed Initiative Manager work routes to the canonical specialist with complete capability coverage.",
  "scenario": "The Principal requests a bounded Initiative Manager deliverable using the supplied fixture facts; no external action is authorized.",
  "success_criteria": [
    "Lead specialist is SPECIALIST-PORTFOLIO-AND-INITIATIVE-STRATEGIST.",
    "All required capabilities are covered.",
    "Mapped craft standards are present.",
    "No external action is executed."
  ]
}
