{
  "component_id": "SPECIALIST-WORKFLOW-AUTOMATION-ENGINEER",
  "component_type": "specialist",
  "evaluation": {
    "assertions": [
      "lead_specialist",
      "model_class",
      "no_missing_capabilities",
      "craft_standards_present"
    ],
    "method": "deterministic_router_assertions"
  },
  "evidence": [
    "RouteDecision JSON",
    "selected specialist and craft-standard IDs",
    "missing-capability set"
  ],
  "expected": {
    "craft_standards": [
      "CS-OPS-001",
      "CS-OPS-003",
      "CS-OPS-005"
    ],
    "lead_guild": "GUILD-OPERATIONS-AUTOMATION-ENGINEERING",
    "lead_specialist": "SPECIALIST-WORKFLOW-AUTOMATION-ENGINEER",
    "missing_capabilities": [],
    "model_class": "routine"
  },
  "failure_criteria": [
    "A different lead specialist is selected.",
    "Any capability is silently omitted.",
    "The route names a provider instead of a model class.",
    "The fixture is modified during evaluation."
  ],
  "fixture_version": "1.0.0",
  "id": "BENCH-S017",
  "inputs": {
    "facts": {
      "approved_scope": "Operations",
      "external_action_authorized": false,
      "fixture_id": "BENCH-S017",
      "known_constraint": "Preserve the supplied scope and identify uncertainty."
    },
    "preferred_model_class": "routine",
    "principal_instruction": "Fixture BENCH-S017: produce the Workflow Coordinator analysis from the supplied facts, state assumptions, and propose evidence without taking an external action.",
    "required_capabilities": [
      "workflow_design",
      "workflow_coordination",
      "scheduling",
      "state_tracking",
      "process_improvement"
    ]
  },
  "objective": "Verify that fixed Workflow Coordinator work routes to the canonical specialist with complete capability coverage.",
  "scenario": "The Principal requests a bounded Workflow Coordinator deliverable using the supplied fixture facts; no external action is authorized.",
  "success_criteria": [
    "Lead specialist is SPECIALIST-WORKFLOW-AUTOMATION-ENGINEER.",
    "All required capabilities are covered.",
    "Mapped craft standards are present.",
    "No external action is executed."
  ]
}
