{
  "component_id": "SPECIALIST-TECHNOLOGY-INTELLIGENCE-ANALYST",
  "component_type": "specialist",
  "evaluation": {
    "assertions": [
      "lead_specialist",
      "model_class",
      "no_missing_capabilities",
      "craft_standards_present"
    ],
    "method": "deterministic_router_assertions"
  },
  "evidence": [
    "RouteDecision JSON",
    "selected specialist and craft-standard IDs",
    "missing-capability set"
  ],
  "expected": {
    "craft_standards": [
      "CS-RINT-001",
      "CS-RINT-003",
      "CS-RINT-006"
    ],
    "lead_guild": "GUILD-RESEARCH-INTELLIGENCE",
    "lead_specialist": "SPECIALIST-TECHNOLOGY-INTELLIGENCE-ANALYST",
    "missing_capabilities": [],
    "model_class": "executive"
  },
  "failure_criteria": [
    "A different lead specialist is selected.",
    "Any capability is silently omitted.",
    "The route names a provider instead of a model class.",
    "The fixture is modified during evaluation."
  ],
  "fixture_version": "1.0.0",
  "id": "BENCH-S007",
  "inputs": {
    "facts": {
      "approved_scope": "Research",
      "external_action_authorized": false,
      "fixture_id": "BENCH-S007",
      "known_constraint": "Preserve the supplied scope and identify uncertainty."
    },
    "preferred_model_class": "executive",
    "principal_instruction": "Fixture BENCH-S007: produce the Technology Scout analysis from the supplied facts, state assumptions, and propose evidence without taking an external action.",
    "required_capabilities": [
      "technology_scouting",
      "technology_research",
      "weak_signal_detection",
      "innovation_research"
    ]
  },
  "objective": "Verify that fixed Technology Scout work routes to the canonical specialist with complete capability coverage.",
  "scenario": "The Principal requests a bounded Technology Scout deliverable using the supplied fixture facts; no external action is authorized.",
  "success_criteria": [
    "Lead specialist is SPECIALIST-TECHNOLOGY-INTELLIGENCE-ANALYST.",
    "All required capabilities are covered.",
    "Mapped craft standards are present.",
    "No external action is executed."
  ]
}
