{
  "component_id": "SPECIALIST-MARKET-RESEARCHER",
  "component_type": "specialist",
  "evaluation": {
    "assertions": [
      "lead_specialist",
      "model_class",
      "no_missing_capabilities",
      "craft_standards_present"
    ],
    "method": "deterministic_router_assertions"
  },
  "evidence": [
    "RouteDecision JSON",
    "selected specialist and craft-standard IDs",
    "missing-capability set"
  ],
  "expected": {
    "craft_standards": [
      "CS-RINT-001",
      "CS-RINT-003",
      "CS-RINT-004"
    ],
    "lead_guild": "GUILD-RESEARCH-INTELLIGENCE",
    "lead_specialist": "SPECIALIST-MARKET-RESEARCHER",
    "missing_capabilities": [],
    "model_class": "executive"
  },
  "failure_criteria": [
    "A different lead specialist is selected.",
    "Any capability is silently omitted.",
    "The route names a provider instead of a model class.",
    "The fixture is modified during evaluation."
  ],
  "fixture_version": "1.0.0",
  "id": "BENCH-S010",
  "inputs": {
    "facts": {
      "approved_scope": "Research",
      "external_action_authorized": false,
      "fixture_id": "BENCH-S010",
      "known_constraint": "Preserve the supplied scope and identify uncertainty."
    },
    "preferred_model_class": "executive",
    "principal_instruction": "Fixture BENCH-S010: produce the Market Research Analyst analysis from the supplied facts, state assumptions, and propose evidence without taking an external action.",
    "required_capabilities": [
      "market_research",
      "demand_analysis",
      "segmentation",
      "customer_research",
      "evidence_synthesis"
    ]
  },
  "objective": "Verify that fixed Market Research Analyst work routes to the canonical specialist with complete capability coverage.",
  "scenario": "The Principal requests a bounded Market Research Analyst deliverable using the supplied fixture facts; no external action is authorized.",
  "success_criteria": [
    "Lead specialist is SPECIALIST-MARKET-RESEARCHER.",
    "All required capabilities are covered.",
    "Mapped craft standards are present.",
    "No external action is executed."
  ]
}
