{
  "component_id": "SPECIALIST-PRODUCT-DESIGNER",
  "component_type": "specialist",
  "evaluation": {
    "assertions": [
      "lead_specialist",
      "model_class",
      "no_missing_capabilities",
      "craft_standards_present"
    ],
    "method": "deterministic_router_assertions"
  },
  "evidence": [
    "RouteDecision JSON",
    "selected specialist and craft-standard IDs",
    "missing-capability set"
  ],
  "expected": {
    "craft_standards": [
      "CS-EXP-001",
      "CS-EXP-003",
      "CS-EXP-006",
      "CS-EXP-007",
      "CS-EXP-008",
      "CS-003"
    ],
    "lead_guild": "GUILD-EXPERIENCE-DESIGN",
    "lead_specialist": "SPECIALIST-PRODUCT-DESIGNER",
    "missing_capabilities": [],
    "model_class": "executive"
  },
  "failure_criteria": [
    "A different lead specialist is selected.",
    "Any capability is silently omitted.",
    "The route names a provider instead of a model class.",
    "The fixture is modified during evaluation."
  ],
  "fixture_version": "1.0.0",
  "id": "BENCH-S032",
  "inputs": {
    "facts": {
      "approved_scope": "Design",
      "external_action_authorized": false,
      "fixture_id": "BENCH-S032",
      "known_constraint": "Preserve the supplied scope and identify uncertainty."
    },
    "preferred_model_class": "executive",
    "principal_instruction": "Fixture BENCH-S032: produce the Web & Product Designer analysis from the supplied facts, state assumptions, and propose evidence without taking an external action.",
    "required_capabilities": [
      "product_design",
      "web_design",
      "interaction_design",
      "visual_design",
      "baseline_preservation"
    ]
  },
  "objective": "Verify that fixed Web & Product Designer work routes to the canonical specialist with complete capability coverage.",
  "scenario": "The Principal requests a bounded Web & Product Designer deliverable using the supplied fixture facts; no external action is authorized.",
  "success_criteria": [
    "Lead specialist is SPECIALIST-PRODUCT-DESIGNER.",
    "All required capabilities are covered.",
    "Mapped craft standards are present.",
    "No external action is executed."
  ]
}
