{
  "component_id": "SPECIALIST-TECHNICAL-WRITER",
  "component_type": "specialist",
  "evaluation": {
    "assertions": [
      "lead_specialist",
      "model_class",
      "no_missing_capabilities",
      "craft_standards_present"
    ],
    "method": "deterministic_router_assertions"
  },
  "evidence": [
    "RouteDecision JSON",
    "selected specialist and craft-standard IDs",
    "missing-capability set"
  ],
  "expected": {
    "craft_standards": [
      "CS-COMK-001",
      "CS-COMK-004",
      "CS-COMK-005",
      "CS-003"
    ],
    "lead_guild": "GUILD-COMMUNICATIONS-KNOWLEDGE",
    "lead_specialist": "SPECIALIST-TECHNICAL-WRITER",
    "missing_capabilities": [],
    "model_class": "routine"
  },
  "failure_criteria": [
    "A different lead specialist is selected.",
    "Any capability is silently omitted.",
    "The route names a provider instead of a model class.",
    "The fixture is modified during evaluation."
  ],
  "fixture_version": "1.0.0",
  "id": "BENCH-S020",
  "inputs": {
    "facts": {
      "approved_scope": "Communications",
      "external_action_authorized": false,
      "fixture_id": "BENCH-S020",
      "known_constraint": "Preserve the supplied scope and identify uncertainty."
    },
    "preferred_model_class": "routine",
    "principal_instruction": "Fixture BENCH-S020: produce the Technical Writer analysis from the supplied facts, state assumptions, and propose evidence without taking an external action.",
    "required_capabilities": [
      "writing",
      "technical_writing",
      "documentation",
      "developer_communication"
    ]
  },
  "objective": "Verify that fixed Technical Writer work routes to the canonical specialist with complete capability coverage.",
  "scenario": "The Principal requests a bounded Technical Writer deliverable using the supplied fixture facts; no external action is authorized.",
  "success_criteria": [
    "Lead specialist is SPECIALIST-TECHNICAL-WRITER.",
    "All required capabilities are covered.",
    "Mapped craft standards are present.",
    "No external action is executed."
  ]
}
