{
  "component_id": "SPECIALIST-037",
  "component_type": "specialist",
  "evaluation": {
    "assertions": [
      "lead_specialist",
      "model_class",
      "no_missing_capabilities",
      "craft_standards_present"
    ],
    "method": "deterministic_router_assertions"
  },
  "evidence": [
    "RouteDecision JSON",
    "selected specialist and craft-standard IDs",
    "missing-capability set"
  ],
  "expected": {
    "craft_standards": [
      "CS-007",
      "CS-008"
    ],
    "lead_guild": "Code Testing",
    "lead_specialist": "SPECIALIST-037",
    "missing_capabilities": [],
    "model_class": "routine"
  },
  "failure_criteria": [
    "A different lead specialist is selected.",
    "A requested code-testing capability is silently omitted.",
    "The route names a provider instead of a model class.",
    "The fixture is modified during evaluation."
  ],
  "fixture_version": "1.0.0",
  "id": "BENCH-S037",
  "inputs": {
    "facts": {
      "approved_scope": "Code verification work for the Acceptance Test Architect role",
      "external_action_authorized": false,
      "fixture_id": "BENCH-S037",
      "known_constraint": "Commands come only from the repository testing manifest; none are invented."
    },
    "preferred_model_class": "routine",
    "principal_instruction": "Route bounded code-testing work to the Acceptance Test Architect and cover the requested capabilities without executing external actions.",
    "required_capabilities": [
      "acceptance_test_authoring",
      "behavior_contract_protection"
    ]
  },
  "objective": "Verify that bounded Acceptance Test Architect work routes to SPECIALIST-037 with complete capability coverage.",
  "scenario": "The Principal requests Acceptance Test Architect work on a code change; verification is deterministic and record-only.",
  "success_criteria": [
    "Lead specialist is SPECIALIST-037.",
    "All requested capabilities are covered.",
    "CS-007, CS-008 are mapped.",
    "No external action is executed."
  ]
}
