{
  "component_id": "SPECIALIST-SOFTWARE-ENGINEER",
  "component_type": "specialist",
  "evaluation": {
    "assertions": [
      "lead_specialist",
      "model_class",
      "no_missing_capabilities",
      "craft_standards_present"
    ],
    "method": "deterministic_router_assertions"
  },
  "evidence": [
    "RouteDecision JSON",
    "selected specialist and craft-standard IDs",
    "missing-capability set"
  ],
  "expected": {
    "craft_standards": [
      "CS-SWE-001",
      "CS-SWE-003",
      "CS-SWE-006"
    ],
    "lead_guild": "GUILD-SOFTWARE-ENGINEERING",
    "lead_specialist": "SPECIALIST-SOFTWARE-ENGINEER",
    "missing_capabilities": [],
    "model_class": "executive"
  },
  "failure_criteria": [
    "A different lead specialist is selected.",
    "Any capability is silently omitted.",
    "The route names a provider instead of a model class.",
    "The fixture is modified during evaluation."
  ],
  "fixture_version": "1.0.0",
  "id": "BENCH-S012",
  "inputs": {
    "facts": {
      "approved_scope": "Engineering",
      "external_action_authorized": false,
      "fixture_id": "BENCH-S012",
      "known_constraint": "Preserve the supplied scope and identify uncertainty."
    },
    "preferred_model_class": "executive",
    "principal_instruction": "Fixture BENCH-S012: produce the Software Engineer analysis from the supplied facts, state assumptions, and propose evidence without taking an external action.",
    "required_capabilities": [
      "software_implementation",
      "automation",
      "integration",
      "code_generation",
      "data_modeling"
    ]
  },
  "objective": "Verify that fixed Software Engineer work routes to the canonical specialist with complete capability coverage.",
  "scenario": "The Principal requests a bounded Software Engineer deliverable using the supplied fixture facts; no external action is authorized.",
  "success_criteria": [
    "Lead specialist is SPECIALIST-SOFTWARE-ENGINEER.",
    "All required capabilities are covered.",
    "Mapped craft standards are present.",
    "No external action is executed."
  ]
}
