{
  "component_id": "SO-026",
  "component_type": "standing_operation",
  "evaluation": {
    "assertions": [
      "workflow_identity",
      "model_class",
      "minimum_steps",
      "unique_step_ids"
    ],
    "method": "workflow_definition_assertions"
  },
  "evidence": [
    "WorkflowDefinition JSON",
    "step and dependency set",
    "catalog mapping"
  ],
  "expected": {
    "evidence_record_required": true,
    "minimum_steps": 3,
    "model_class": "routine",
    "result_values": ["ok", "silent", "error"],
    "so_id": "SO-026"
  },
  "failure_criteria": [
    "Workflow identity or model class differs from the fixture.",
    "A dependency references a missing step.",
    "The workflow omits assessment, independent review, or Principal reporting.",
    "A live side effect occurs during the core evaluation."
  ],
  "fixture_version": "1.0.0",
  "id": "BENCH-O026",
  "inputs": {
    "fixture": {
      "live_side_effects": false,
      "records": 1,
      "source": "packaged deterministic benchmark"
    },
    "idempotency_key": "SO-026:2030-01-07T12:00:00Z:fixture-1",
    "scheduled_for": "2030-01-07T12:00:00Z"
  },
  "objective": "Verify the Continuous Adversarial Assurance workflow identity, DAG shape, and record-only contract.",
  "scenario": "Run SO-026 against a deterministic fixture without network, shell, credential, or destructive adapters.",
  "success_criteria": [
    "Workflow resolves as SO-026.",
    "Step identifiers are unique and dependencies resolve.",
    "The workflow includes inventory, assessment plus review, and reporting.",
    "The run contract requires one evidence record."
  ]
}
