{
  "component_id": "SPECIALIST-EVIDENCE-INTEGRITY-ANALYST",
  "component_type": "specialist",
  "evaluation": {
    "assertions": [
      "lead_specialist",
      "model_class",
      "no_missing_capabilities",
      "craft_standards_present"
    ],
    "method": "deterministic_router_assertions"
  },
  "evidence": [
    "RouteDecision JSON",
    "selected specialist and craft-standard IDs",
    "missing-capability set"
  ],
  "expected": {
    "craft_standards": [
      "CS-RINT-001",
      "CS-RINT-003",
      "CS-003"
    ],
    "lead_guild": "GUILD-RESEARCH-INTELLIGENCE",
    "lead_specialist": "SPECIALIST-EVIDENCE-INTEGRITY-ANALYST",
    "missing_capabilities": [],
    "model_class": "review"
  },
  "failure_criteria": [
    "A different lead specialist is selected.",
    "Any capability is silently omitted.",
    "The route names a provider instead of a model class.",
    "The fixture is modified during evaluation."
  ],
  "fixture_version": "1.0.0",
  "id": "BENCH-S008",
  "inputs": {
    "facts": {
      "approved_scope": "Research",
      "external_action_authorized": false,
      "fixture_id": "BENCH-S008",
      "known_constraint": "Preserve the supplied scope and identify uncertainty."
    },
    "preferred_model_class": "review",
    "principal_instruction": "Fixture BENCH-S008: produce the Source Validator analysis from the supplied facts, state assumptions, and propose evidence without taking an external action.",
    "required_capabilities": [
      "source_evaluation",
      "source_validation",
      "fact_checking",
      "recency_analysis",
      "independence_analysis"
    ]
  },
  "objective": "Verify that fixed Source Validator work routes to the canonical specialist with complete capability coverage.",
  "scenario": "The Principal requests a bounded Source Validator deliverable using the supplied fixture facts; no external action is authorized.",
  "success_criteria": [
    "Lead specialist is SPECIALIST-EVIDENCE-INTEGRITY-ANALYST.",
    "All required capabilities are covered.",
    "Mapped craft standards are present.",
    "No external action is executed."
  ]
}
