{
  "component_id": "SPECIALIST-CODE-AND-STRUCTURAL-TEST-ENGINEER",
  "component_type": "specialist",
  "evaluation": {
    "assertions": [
      "lead_specialist",
      "model_class",
      "no_missing_capabilities",
      "craft_standards_present"
    ],
    "method": "deterministic_router_assertions"
  },
  "evidence": [
    "RouteDecision JSON",
    "selected specialist and craft-standard IDs",
    "missing-capability set"
  ],
  "expected": {
    "craft_standards": [
      "CS-QA-001",
      "CS-QA-005"
    ],
    "lead_guild": "GUILD-QUALITY-RELEASE-ASSURANCE",
    "lead_specialist": "SPECIALIST-CODE-AND-STRUCTURAL-TEST-ENGINEER",
    "missing_capabilities": [],
    "model_class": "routine"
  },
  "failure_criteria": [
    "A different lead specialist is selected.",
    "A requested code-testing capability is silently omitted.",
    "The route names a provider instead of a model class.",
    "The fixture is modified during evaluation."
  ],
  "fixture_version": "1.0.0",
  "id": "BENCH-S038",
  "inputs": {
    "facts": {
      "approved_scope": "Code verification work for the Characterization Test Engineer role",
      "external_action_authorized": false,
      "fixture_id": "BENCH-S038",
      "known_constraint": "Commands come only from the repository testing manifest; none are invented."
    },
    "preferred_model_class": "routine",
    "principal_instruction": "Route bounded code-testing work to the Characterization Test Engineer and cover the requested capabilities without executing external actions.",
    "required_capabilities": [
      "characterization_testing",
      "legacy_behavior_baselining"
    ]
  },
  "objective": "Verify that bounded Characterization Test Engineer work routes to SPECIALIST-038 with complete capability coverage.",
  "scenario": "The Principal requests Characterization Test Engineer work on a code change; verification is deterministic and record-only.",
  "success_criteria": [
    "Lead specialist is SPECIALIST-CODE-AND-STRUCTURAL-TEST-ENGINEER.",
    "All requested capabilities are covered.",
    "CS-007, CS-008 are mapped.",
    "No external action is executed."
  ]
}
