{
  "component_id": "SPECIALIST-SCENARIO-AND-STRATEGIC-RISK-ANALYST",
  "component_type": "specialist",
  "evaluation": {
    "assertions": [
      "lead_specialist",
      "model_class",
      "no_missing_capabilities",
      "craft_standards_present"
    ],
    "method": "deterministic_router_assertions"
  },
  "evidence": [
    "RouteDecision JSON",
    "selected specialist and craft-standard IDs",
    "missing-capability set"
  ],
  "expected": {
    "craft_standards": [
      "CS-STRAT-001",
      "CS-STRAT-004"
    ],
    "lead_guild": "GUILD-STRATEGY-DECISIONS-PORTFOLIO",
    "lead_specialist": "SPECIALIST-SCENARIO-AND-STRATEGIC-RISK-ANALYST",
    "missing_capabilities": [],
    "model_class": "executive"
  },
  "failure_criteria": [
    "A different lead specialist is selected.",
    "Any capability is silently omitted.",
    "The route names a provider instead of a model class.",
    "The fixture is modified during evaluation."
  ],
  "fixture_version": "1.0.0",
  "id": "BENCH-S004",
  "inputs": {
    "facts": {
      "approved_scope": "Executive",
      "external_action_authorized": false,
      "fixture_id": "BENCH-S004",
      "known_constraint": "Preserve the supplied scope and identify uncertainty."
    },
    "preferred_model_class": "executive",
    "principal_instruction": "Fixture BENCH-S004: produce the Risk Analyst analysis from the supplied facts, state assumptions, and propose evidence without taking an external action.",
    "required_capabilities": [
      "risk_triage",
      "risk_analysis",
      "scenario_analysis",
      "mitigation_planning"
    ]
  },
  "objective": "Verify that fixed Risk Analyst work routes to the canonical specialist with complete capability coverage.",
  "scenario": "The Principal requests a bounded Risk Analyst deliverable using the supplied fixture facts; no external action is authorized.",
  "success_criteria": [
    "Lead specialist is SPECIALIST-SCENARIO-AND-STRATEGIC-RISK-ANALYST.",
    "All required capabilities are covered.",
    "Mapped craft standards are present.",
    "No external action is executed."
  ]
}
