{
  "component_id": "SPECIALIST-045",
  "component_type": "specialist",
  "evaluation": {
    "assertions": [
      "lead_specialist",
      "model_class",
      "no_missing_capabilities",
      "craft_standards_present"
    ],
    "method": "deterministic_router_assertions"
  },
  "evidence": [
    "RouteDecision JSON",
    "selected specialist and craft-standard IDs",
    "missing-capability set"
  ],
  "expected": {
    "craft_standards": [
      "CS-003",
      "CS-008",
      "CS-009"
    ],
    "lead_guild": "Code Testing",
    "lead_specialist": "SPECIALIST-045",
    "missing_capabilities": [],
    "model_class": "executive"
  },
  "failure_criteria": [
    "A different lead specialist is selected.",
    "A requested code-testing capability is silently omitted.",
    "The route names a provider instead of a model class.",
    "The fixture is modified during evaluation."
  ],
  "fixture_version": "1.0.0",
  "id": "BENCH-S045",
  "inputs": {
    "facts": {
      "approved_scope": "Code verification work for the Release Verification Auditor role",
      "external_action_authorized": false,
      "fixture_id": "BENCH-S045",
      "known_constraint": "Commands come only from the repository testing manifest; none are invented."
    },
    "preferred_model_class": "executive",
    "principal_instruction": "Route bounded code-testing work to the Release Verification Auditor and cover the requested capabilities without executing external actions.",
    "required_capabilities": [
      "release_verification",
      "evidence_audit"
    ]
  },
  "objective": "Verify that bounded Release Verification Auditor work routes to SPECIALIST-045 with complete capability coverage.",
  "scenario": "The Principal requests Release Verification Auditor work on a code change; verification is deterministic and record-only.",
  "success_criteria": [
    "Lead specialist is SPECIALIST-045.",
    "All requested capabilities are covered.",
    "CS-003, CS-008, CS-009 are mapped.",
    "No external action is executed."
  ]
}
